{
  "schema_version": "1.0.0",
  "command": "jankurai migrate",
  "status": "complete",
  "generated_at": "0",
  "source_report": "target/jankurai/migration-report.json",
  "target_stack": "rust-python-postgres",
  "plan_mode": "dry-run",
  "slices": [
    {
      "slice_id": "model-port",
      "owner": "tools",
      "status": "candidate",
      "risk_level": "high",
      "dependency_order": 1,
      "human_approval_required": true,
      "allowed_paths": ["python/", "src/"],
      "forbidden_paths": ["docs/"],
      "contracts": ["model boundary"],
      "tests": ["pytest -q", "cargo test"],
      "proof_lanes": ["fast"],
      "rollback_notes": ["restore model port"],
      "cutover_notes": ["shadow/equivalence gate before cutover"],
      "notes": "env MODEL_HMAC_KEY and MODEL_CHECKPOINT required"
    },
    {
      "slice_id": "docs-cleanup",
      "owner": "tools",
      "status": "candidate",
      "risk_level": "low",
      "dependency_order": 2,
      "human_approval_required": false,
      "allowed_paths": ["docs/"],
      "forbidden_paths": [],
      "contracts": ["docs only"],
      "tests": ["just fast"],
      "proof_lanes": ["fast"],
      "rollback_notes": ["revert docs"],
      "notes": "documentation only"
    }
  ],
  "human_approval_requirements": [
    "high-risk cutovers require human review"
  ]
}
